source_id,route_id,authors,year,title,venue_status,source_tier,exact_project_use,claim_status,next_action,url
SRC-RIEMANN-1859,H0,Bernhard Riemann,1859,On the Number of Prime Numbers less than a Given Quantity,canonical primary source,S0,xi and explicit-formula origin,ESTABLISHED,retain as route anchor,https://www.claymath.org/wp-content/uploads/2023/04/Wilkins-translation.pdf
SRC-BOMBIERI-CLAY-2000,H0,Enrico Bombieri,2000,Problems of the Millennium: The Riemann Hypothesis,authoritative problem description,S0,standard target and historical overview,ESTABLISHED,retain as global orientation source,https://www.claymath.org/wp-content/uploads/2022/05/riemann.pdf
SRC-LEVINSON-1974,H1,Norman Levinson,1974,More than one third of the zeros of Riemann's zeta-function are on sigma=1/2,peer-reviewed,S0,mollifier and critical-zero proportion route,ESTABLISHED,build H1 route card,
SRC-CONREY-1989,H1,J. B. Conrey,1989,More than two fifths of the zeros of the Riemann zeta function are on the critical line,peer-reviewed,S0,refined mollifier and critical-zero proportion route,ESTABLISHED,build H1 route card,https://eudml.org/doc/153151
SRC-PRATT-ROBLES-ZAHARESCU-ZEINDLER-2018,H1,Kyle Pratt and Nicolas Robles and Alexandru Zaharescu and Dirk Zeindler,2018,More than five-twelfths of the zeros of zeta are on the critical line,peer-reviewed preprint version,S1,strongest audited unconditional critical-zero proportion,ESTABLISHED_PARTIAL_RESULT,retain as H1 quantitative frontier,https://arxiv.org/abs/1802.10521
SRC-BOURGAIN-2014,H2,Jean Bourgain,2014,Decoupling exponential sums and the Riemann zeta function,peer-reviewed preprint version,S1,critical-line subconvexity exponent frontier,ESTABLISHED_PARTIAL_RESULT,retain as H2 pointwise-value frontier,https://arxiv.org/abs/1408.5794
SRC-GUTH-MAYNARD-2024,H2,Larry Guth and James Maynard,2024,New large value estimates for Dirichlet polynomials,peer-reviewed 2026 Annals version,S1,zero-density exponent 30 over 13 and large-value mechanism,ESTABLISHED_PARTIAL_RESULT,retain as H2 zero-density frontier,https://arxiv.org/abs/2405.20552
SRC-BAEZ-DUARTE-2002,H3,Luis Baez-Duarte,2002,A strengthening of the Nyman-Beurling criterion for the Riemann Hypothesis,peer-reviewed preprint version,S0,positive-natural Hilbert closure criterion,ESTABLISHED,retain and cross-audit compiled theorem,https://arxiv.org/abs/math/0202141
SRC-LI-1997,H4,Xian-Jin Li,1997,The positivity of a sequence of numbers and the Riemann hypothesis,peer-reviewed,S0,all-index Li positivity criterion,ESTABLISHED,external statement crosswalk,
SRC-BOMBIERI-LAGARIAS-1999,H4,Enrico Bombieri and Jeffrey C. Lagarias,1999,Complements to Li's Criterion for the Riemann Hypothesis,peer-reviewed,S0,transformed-zero reverse mechanism,ESTABLISHED,external statement crosswalk,https://math.lsa.umich.edu/~lagarias/doc/bombieri.ps
SRC-WEIL-1952,H5,Andre Weil,1952,Sur les formules explicites de la theorie des nombres premiers,peer-reviewed,S0,explicit-formula positivity criterion,ESTABLISHED,freeze exact admissible class,
SRC-RODGERS-TAO-2018,H6,Brad Rodgers and Terence Tao,2018,The de Bruijn-Newman constant is non-negative,peer-reviewed preprint version,S0,heat-flow and zero-dynamics route,ESTABLISHED,build H6 route card,https://arxiv.org/abs/1801.05914
SRC-BRANDEN-CHASSE-2016,H6-H8,Petter Branden and Matthew Chasse,2016,Classification theorems for operators preserving zeros in a strip,peer-reviewed preprint version,S1,de Bruijn shifted Jensen theorem and entire strip-preserver mechanism,ESTABLISHED,reconstruct H6 forward preservation,https://arxiv.org/abs/1402.2795
SRC-POLYMATH-2019,H6,D. H. J. Polymath,2019,Effective approximation of heat flow evolution of the Riemann xi function and a new upper bound for the de Bruijn-Newman constant,peer-reviewed,S1,unconditional upper bound Lambda at most 0.22 and effective heat-flow estimates,ESTABLISHED_PARTIAL_RESULT,retain as H6 quantitative frontier,https://arxiv.org/abs/1904.12438
SRC-CONNES-1998,H7,Alain Connes,1998,Trace formula in noncommutative geometry and the zeros of the Riemann zeta function,peer-reviewed preprint version,S1,spectral and trace-formula route,ESTABLISHED_WITH_OPEN_BRIDGE,build H7 route card,https://arxiv.org/abs/math/9811068
SRC-DEBRANGES-1986,H7-H8,Louis de Branges,1986,The Riemann hypothesis for Hilbert spaces of entire functions,peer-reviewed,S1,entire-function Hilbert spaces and spectral structure,OPEN_PROGRAM,build H7-H8 boundary map,https://projecteuclid.org/journals/bulletin-of-the-american-mathematical-society-new-series/volume-15/issue-1/The-Riemann-hypothesis-for-Hilbert-spaces-of-entire-functions/bams/1183553352.short
SRC-GRIFFIN-ONO-ROLEN-ZAGIER-2019,H8,Michael Griffin and Ken Ono and Larry Rolen and Don Zagier,2019,Jensen polynomials for the Riemann zeta function and other sequences,peer-reviewed preprint version,S1,eventual finite-degree hyperbolicity and asymptotics,ESTABLISHED_PARTIAL_RESULT,record exact limitation,https://arxiv.org/abs/1902.07321
SRC-FARMER-2020,H8,David W. Farmer,2020,Jensen polynomials are not a plausible route to proving the Riemann Hypothesis,peer-reviewed preprint version,S1,negative route assessment,ESTABLISHED_CRITIQUE,include in H8 adversarial audit,https://arxiv.org/abs/2008.07206
SRC-LAGARIAS-2000,H9,Jeffrey C. Lagarias,2000,An Elementary Problem Equivalent to the Riemann Hypothesis,peer-reviewed preprint version,S0,elementary divisor-sum equivalent,ESTABLISHED,build H9 usefulness audit,https://arxiv.org/abs/math/0008177
SRC-DELIGNE-1974,H10,Pierre Deligne,1974,La conjecture de Weil I,peer-reviewed,S0,function-field and Frobenius analogy,ESTABLISHED,build H10 transfer-gap card,https://publications.ias.edu/book/export/html/368
SRC-STEPANOV-1969,H10,S. A. Stepanov,1969,On the number of points of a hyperelliptic curve over a finite prime field,peer-reviewed,S0,auxiliary-function and high-multiplicity point-count method,ESTABLISHED,retain as original H10 method source,https://www.mathnet.ru/eng/im2197
SRC-BOMBIERI-1973,H10,Enrico Bombieri,1973,Counting points on curves over finite fields d'apres S. A. Stepanov,Seminaire Bourbaki,S0,general Riemann-Roch Frobenius proof and finite spectral transition,ESTABLISHED,formalize finite power-sum rigidity and record transfer gap,https://www.numdam.org/item/SB_1972-1973__15__234_0.pdf
SRC-MONTGOMERY-1973,H11,H. L. Montgomery,1973,The pair correlation of zeros of the zeta function,peer-reviewed proceedings,S0,zero-statistics and random-matrix route,CONDITIONAL_ON_RH_IN_HEADLINE_ANALYSIS,keep heuristic separate from proof premise,https://websites.umich.edu/~hlm/paircor1.pdf
SRC-WONG-2023,H3,Kwok Kwan Wong,2023,Inequality and Nyman-Beurling-Baez-Duarte criteria,unreviewed arXiv proof claim,S4,projection-norm proof branch,DECISIVE_STEP_FORMALLY_FALSIFIED,regression test only,https://arxiv.org/abs/2310.03972
SRC-CARVILL-2025,H3,Hugh Carvill,2025,Beurling-Nyman Geometry and Gram Matrix Structure: Ladder Density and Polynomial Decay via Mellin Smoothing,unreviewed arXiv preprint,S4,ladder-frequency proof branch,DECISIVE_STEP_FORMALLY_FALSIFIED,retain acknowledgement and regression test only,https://arxiv.org/abs/2510.18132
SRC-POLSON-2018,H5,Nick Polson,2018,Riemann Hypothesis: a GGC factorisation,arXiv preprint,S2,Frullani continuation mechanism,SPECIFIC_2018_INTEGRAL_RETENTION_REJECTED,do not reject later equivalence framework,https://arxiv.org/abs/1806.07964v7
SRC-FREEDMAN-2026,H7,Marvin B. Freedman,2026,Finite-core Volterra reductions for a Weyl-positive Riemann phase kernel,unreviewed arXiv proof-program preprint,S3,Green-lift contraction inference,LISTED_PREMISES_FORMALLY_INSUFFICIENT,quarantine pending concrete norm estimate,https://arxiv.org/abs/2606.29555
SRC-CSORDAS-VARGA-1988,H6,George Csordas and Richard S. Varga,1988,Moment Inequalities and the Riemann Hypothesis,peer-reviewed,S0,actual source-normalized Xi-kernel strict log-concavity,KNOWN_THEOREM_INDEPENDENTLY_FORMALIZED,retain as H6-X6 primary source,https://www.math.kent.edu/~varga/pub/paper_161.pdf
SRC-COFFEY-CSORDAS-2013,H6,Mark W. Coffey and George Csordas,2013,On the log-concavity of a Jacobi theta function,peer-reviewed,S0,later proof of the Xi-kernel shape property,ESTABLISHED,retain as H6-X6 secondary source,https://doi.org/10.1090/S0025-5718-2013-02681-6
SRC-GERSHON-2026,H6,Avi Gershon,2026,On the Log-Concavity of the Riemann Xi Kernel,unreviewed preprint with external Lean claim,S3,theta-kernel TP2 and external certification audit,EXTERNAL_LEAN_CERTIFICATE_REJECTED_ACTUAL_TP2_INDEPENDENTLY_FORMALIZED,do not use external certificate as premise,https://doi.org/10.20944/preprints202604.0159.v2
SRC-MICHALOWSKI-2026-PF5,H6,Wojciech Michalowski,2026,On the Polya Frequency Order of the de Bruijn Newman Kernel: Certified Failure at Order Five and the Toeplitz Threshold Phenomenon,unreviewed arXiv preprint with external interval certificate,S3,actual-kernel PF5 falsification target,LEAN_FULL_SERIES_PF5_FALSIFICATION_LOCAL_AUDIT_PASSED_PUBLIC_CI_PENDING,record public implementation and evidence CI,https://arxiv.org/abs/2602.20313
